[
  {
    "request_id": "CR-1001",
    "submitted_at": "2026-05-28T09:15:00Z",
    "submitted_by": "synthetic_user_001",
    "department": "SAP Customer Experience & Success Enablement",
    "role": "product manager",
    "source": "Teams Bot",
    "entry_point": "personal_bot",
    "raw_request": "It would be nice if lessons were available in podcast format",
    "cleaned_request": "Add podcast/audio mode for learning content",
    "problem": "Users want to consume learning material while commuting or multitasking",
    "desired_outcome": "More flexible learning experience accessible on-the-go",
    "feature_category": "Learning Experience",
    "capability_area": "Content Delivery",
    "urgency": "Important",
    "frequency": "Weekly",
    "affected_workflow": "Experience Garage mission learning",
    "interview_opt_in": true,
    "preferred_follow_up_method": "Teams",
    "interview_context": "User is willing to discuss commute-based and audio-first learning use cases.",
    "similar_request_count": 18,
    "status": "new"
  },
  {
    "request_id": "CR-1002",
    "submitted_at": "2026-05-28T11:32:00Z",
    "submitted_by": "synthetic_user_002",
    "department": "SAP Customer Experience & Success Enablement",
    "role": "business user",
    "source": "Teams Bot",
    "entry_point": "business_unit_chat",
    "raw_request": "The ML Workbench is useful, but I wish there was a guided no-code path for business users",
    "cleaned_request": "Introduce a no-code guided workflow in ML Workbench for non-technical users",
    "problem": "Business users feel excluded from ML Workbench due to its technical complexity",
    "desired_outcome": "Ability for non-technical stakeholders to build and run simple ML experiments",
    "feature_category": "ML Tooling",
    "capability_area": "ML Workbench",
    "urgency": "Important",
    "frequency": "Daily",
    "affected_workflow": "ML Workbench",
    "interview_opt_in": true,
    "preferred_follow_up_method": "Email",
    "interview_context": "Has tried AutoML solutions in other platforms and can share comparative feedback.",
    "similar_request_count": 24,
    "status": "new"
  },
  {
    "request_id": "CR-1003",
    "submitted_at": "2026-05-29T14:00:00Z",
    "submitted_by": "synthetic_user_003",
    "department": "SAP Customer Experience & Success Enablement",
    "role": "data analyst",
    "source": "Teams Bot",
    "entry_point": "personal_bot",
    "raw_request": "I need a way to bookmark datasets within the Data Challenges section so I can find them later",
    "cleaned_request": "Add dataset bookmarking feature to Data Challenges",
    "problem": "Analysts re-discover the same datasets manually every session",
    "desired_outcome": "Persistent bookmarks or favorites list for frequently accessed datasets",
    "feature_category": "Data Management",
    "capability_area": "Data Challenges",
    "urgency": "Nice to have",
    "frequency": "Daily",
    "affected_workflow": "Data Challenges",
    "interview_opt_in": false,
    "preferred_follow_up_method": "No preference",
    "interview_context": "",
    "similar_request_count": 9,
    "status": "new"
  }
]
